{
  "key_id": "00000000-0000-4000-8000-000000000018",
  "api_key": "acpk_EXAMPLE_ONLY_NOT_A_REAL_CREDENTIAL",
  "account_id": "00000000-0000-4000-8000-000000000002",
  "client_name": "Roof rig 2",
  "installation_id": "00000000-0000-4000-8000-000000000020",
  "project_ids": [
    "00000000-0000-4000-8000-000000000001"
  ]
}
